app_developer,app_name
"Canva,Moboapps Dev Team,ibis inc.,BaramGames,Blue Brain Technologies,Quantum Appx,The Fashion Crazier,Content Arcade Apps,Viporama,Apps Guruz,Splendid App Maker,4Axis Technologies,Colorfit,Memento Apps,Marcin Lewandowski,BAC Apps,Saee Creations,CREDAPP SOFTWARE PRIVATE LIMITED,PahunSoftwares,Siberman.inc,Ravians Solutions Appx.Inc,Hridhan Studios,Focus apps,Launcher Developer,A-one Studio,Creative APPS,Photo Studio & Picture Editor Lab,AR Tech,Z Tech Apps,FunKidStudio,FunKidStudio,Visual Blasters LLC,Moboapps Dev Team,AppTrends,Adobe,Bhima Apps,Easy Personal, Salary, Home Loan Service,artsoftech,Easy Personal, Salary, Home Loan Service,Visu Entertainment,Trends App,TIC TIC GAMES,Launcher Developer,KGF Developer,Crazy Apps Inc,UVTechnoLab,zaddycarim,Focus apps,Ekadantapps,Mobi App & Thumbnail Maker Inc","Canva: Graphic Design, Video Collage, Logo Maker,U Launcher Lite-New 3D Launcher 2020, Hide apps,ibis Paint X,Glitter dress coloring and drawing book for Kids,Mehndi Designs Offline,Logo Esport Maker | Create Gaming Logo Maker,Light Photo Editor,Thumbnail Maker - Create Banners & Channel Art,Creative Name Art - Name Shadow Art Maker,Light Photo Editor : Best Photo Effect,Poster Maker Flyer Maker 2021 free Ads Page Design,Drawing Desk Draw Paint Color Doodle & Sketch Pad,PaperColor,Animated Sticker Maker WAStickerApps,Floor Plan Creator,Old Age Face Effect,Banner King-Marathi Birthday/Festival Banner Maker,BrandSpot365: Business Marketing & Festival Images,Gram Pradhan Banner Maker,Logo Esport Maker | Create Gaming Logo Maker,FF Logo Maker - Esport & Gaming Logo Maker,Girlfriend Photo Editor - Girlfriend Photo Frames,AR Tattoo - Try it!,X Launcher: With OS13 Style Theme & Control Center,Mehndi Design 2021,How To Draw Flowers,Poster Maker 2021 - Create Flyers & Posters,Logo Maker - Logo Creator, Generator & Designer,Mehndi Designs,Beauty Drawing Pages Make Up Coloring Book Glitter,Baby Shark Coloring Book Glitter,Flipaclip: Cartoon Animation Creator & Art Studio,U Launcher 3D: New Launcher 2020, 3d themes,Name Art Photo Editor - 7Arts Focus n Filter 2021,Adobe Spark Post: Graphic Design & Story Templates,Hindi Poster Maker - Design Banner Flyer in Hindi,Photo Jodne Wala App - Photo Joint Maker Apps,Name Art Photo Editor - Focus n Filters 2021,Video Par Photo Lagana wala apps - Video pe photo,Wedding Card Maker,Mehandi Ka Design - Mehndi Designs 2021,Fruits Coloring Game & Drawing Book,iLauncher for OS - Thousands Themes and Wallpapers,Light Photo Editor - Light Effect on Photo,Girl Photo Editor: Beauty Photo Makeup Look,Fruits Coloring Book & Drawing Book,YO Whats plus Latest Version 2020,Tattoo Maker,DesignerMe: Marriage Invitation Video & Card Maker,Logo Maker - Free Graphic Design & Logo Templates"
app_developer,app_name
"zomato,Swiggy,Jubilant Foodworks,Creative Bee,Sweet Maker Shop,Yum Brands Inc - India Division,McDonald's Apps,Pizza Hut Digital Ventures,Country Delight,Swiggy,McDonald's India – West & South,BURGER KING INDIA LIMITED,Accurate Information & Technology,dineout,Barbeque Nation Hospitality ltd,thirstycrow.info,Uber Technologies, Inc.,Gyan Fresh,PHPL,FOODX,Uengage,Rebel Marketplace Private Limited,zomato,FOODX,Paradisefoodcourt,ALP GAMES,Halalbox,PHPL,Nithra,Hip Bar Private Limited,FoodyBuddy Applications Pvt Ltd,Meat & Spice Pvt. Ltd.,Starbucks Coffee Company,RailRestro - Official IRCTC E-Catering Partner,Milk Mantra Dairy Pvt. Ltd.,Medialab®,IRCTC Official,foodpanda India,Jhoom! Media,bmapps,100code,MAS 3D STUDIO - Racing and Climbing Games,Wow Food,PHPL,21 MEDIA LLP,Livpure Smart Homes,EazyDiner,All In One India,Talabat,Mayur Purushottam Koli","Zomato - Online Food Delivery & Restaurant Reviews,Swiggy Food Order | Online Grocery | Delivery App,Domino's Pizza - Online Food Delivery App,Ice Cream Cake Maker: Dessert Chef,Sweet Bakery Chef Mania- Cake Games For Girls,KFC Online Order and Food Delivery,McDonald's,Pizza Hut Delivery & Takeaway,Country Delight - Online Milk Delivery App,Swiggy Delivery Partner App,McDelivery- McDonald’s India: Food Delivery App,Burger King India,Living Liquidz,Dineout: Best Restaurant Offers, Deals & Events,Barbeque Nation - Best Casual Dining Restaurant,Thirsty Crow - Food & Drinks Delivery App,Uber Eats: Food Delivery,Gyan Fresh,MOJO Pizza - Order Pizza Online | Pizza Delivery,Behrouz Biryani - Order Biryani Online,La Pino'z Order Online Pizza,EatSure - Food Order | Food Delivery App,Zomato Restaurant Partner,Oven Story Pizza - Online Pizza Delivery App,Paradise Biryani Online Delivery,Helicopter Games Simulator : Indian Air Force Game,Halalbox,BOX8 - Order Food Online | Food Delivery App,Samayal Tamil - தமிழ் சமையல்,HIPBAR: The Drinks App | Home Delivery of Drinks!,Chef Buddy: Smart App for Chefs & Food Businesses,Meatigo – Fresh Meats Delivery,Starbucks India,Railrestro - Order Food In Train,Daily Moo - Milk & Breakfast Subscription App,CSMCL Online,IRCTC eCatering - Food on Track,foodpanda: Fastest food delivery, amazing offers,Jhoom - Alcohol Home Delivery Service,Birthday Cake Master Cooking,10000+ Hindi Recipes - हिन्दी रेसिपी बुक,Offroad Farm Tractor Transport: Truck Driving Game,Wow Food: Food Order & Delivery,Itminaan Biryani - Order Biryani Online,TullyGully,Livpure Smart,EazyDiner - Restaurant Deals And Table Reservation,All In One Food Ordering App | Order Food Online,talabat: Food & Grocery Delivery,Talli: Alcohol delivery. Order Beer, Wine & Liquor"
app_developer,app_name
"Comedy,Indian cinema,Action & adventure,Family,Action & adventure,Drama,Action & adventure,Comedy,Comedy,Drama,Birister Sharma,Mukesh Ravichandran,Team Prabhat,Ravindra Prasad,Swami Vivekananda,Mukesh Ravichandran,S.K. Agrawal,George S. Clason,Nandini Saraf,Joseph Murphy,Indian cinema,Action & adventure,Indian cinema,Drama,Action & adventure,Drama,Indian cinema,Drama,Madeline Miller,David J Schwartz,Book 1,J.M. Barlog,Blake Masters,B. K. Chaturvedi,Shri Purohit Swami,Sadhguru,Mocktime Publication,Mocktime Publication,Indian cinema,Drama,Indian cinema,Drama,Indian cinema,Comedy,Action & adventure,Drama,Comedy,Indian cinema,Action & adventure,Action & adventure,Indian cinema,Family,Action & adventure,Sci-fi & fantasy,Indian cinema,Drama,Action & adventure,Vango Creations,Atharv Publication,पं. रवि शास्त्री ,SARITA SHARMA,Robert T. Kiyosaki,Sant Shri Asharamji Ashram,Brian Tracy,Swami Jagadatmananda,Mohd Suhail Ansari,S. Bhushan,Indian cinema,Indian cinema,Action & adventure,Drama,Comedy,Drama,Action & adventure,Action & adventure,Indian cinema,David J Schwartz,Book 1,Daniel Kahneman,James Clear,Cal Newport,Leil Lowndes,Sharma, Robin Shilp Sharma,Mark Manson,Paulo Coelho,Birister Sharma,S.K. Agrawal,Sachin Sinhal,Sachin Sinhal,Meenu Sinhal,Narendra Modi,NK Sondhi,Mahesh Chandr Kaushik,Colin Bryar,Priyanka Chopra Jonas,Namit Arora","Bhangra Paa Le,Mardaani 2,Birds Of Prey And the Fantabulous Emancipation of One Harley Quinn,Tom & Jerry,Monster Hunter,Sound Of Metal,Zack Snyder's Justice League,Superintelligence,The Kid Detective,Judas and the Black Messiah,Life Changing Thoughts From Gita,Hard Work Never Fails,CONCISE INDIAN HISTORY Useful for UPSC, State PSC, SSC, Railway, Banking, Defence and other Competitive Exams,Learn to be successful: Achieve whatever you want,Thoughts of Power,Self Help is the best Help,Biography of Dr. Bhim Rao Ambedkar: Inspirational Biographies for Children,The Richest Man in Babylon: The most inspiring book on wealth ever written,Albert Einstein,The Power of Your Subconscious Mind,Hate story 2,Tenet,Sanam Teri Kasam,Bhool Bhulaiyaa,One Night Stand,Dilwale,Fast & Furious: Hobbs & Shaw,Bajirao Mastani,War,Nasha,Circe: The International No. 1 Bestseller - Shortlisted for the Women's Prize for Fiction 2019,The Magic of Thinking Big,10 Principles To Beat Failure: Illustrated Enhanced Edition 2021 - Added 32 New Chapters, Bonuses, & Illustrations - Revised All Principles,God of War: The Official Novelization,Zero to One: Notes on Start Ups, or How to Build the Future,Vishnu Puran,Bhagavad Gita,Adiyogi: The Source of Yoga,इतिहास (सामान्य ज्ञान) History - General Knowledge GK in Hindi: SSC Railway RRB NTPC UPSC CDS State PSC Exams,General Knowledge for all Competitve Exams: SSC UPSC RAILWAY CDS TET PSC ARMY NAVY AIRFORCE AFCAT EXAMS,Hate story 2,One Night Stand,Hate Story 3,Nasha,Neal 'N' Nikki,Mastizaade,Spider-Man: Homecoming,Southpaw,Love & Other Drugs,Race Gurram,Wonder Woman 1984,Monster Hunter,Hate story 2,Tom & Jerry,Tenet,Sanam Teri Kasam,Spider-Man: Far from Home,Bhool Bhulaiyaa,One Night Stand,Dilwale,Husband-Wife Jokes by Vango Creations | 50 Clean Jokes (Hindi Edition) : पति पत्नी के 50 चुटकुले,भारत का संविधान: Constitution of India,Shrimad Bhagwat Geeta - Gita Saar (Hindi) 2020: भाग 1,टाइम मैनेजमेंट का हिंदी अनुवाद TIME MANAGEMENT IN HINDI: समय का सदुपयोग हिंदी मैं,Rich dad poor dad book summary in hindi,Shrimad Bhagavad Gita - Hindi,Personal Success (Hindi),जीना सीखो (Jeena Sikho),बहादुर भाई : हिन्दी कहानी, चुटकुले और पहेलियाँ - Bahadur Bhai : Hindi Story, Jokes and Puzzles: Bahadur Bhai : Hindi Story, Jokes and Puzzles,Jhatpat English Seekhen,Hate story 2,Sanam Teri Kasam,Bhool Bhulaiyaa,Dilwale,Space Moms,The Wolf of Wall Street,Bajirao Mastani,Raees,The Hitman's Bodyguard,Ra.One,The Magic of Thinking Big,10 Principles To Beat Failure: Illustrated Enhanced Edition 2021 - Added 32 New Chapters, Bonuses, & Illustrations - Revised All Principles,Thinking, Fast and Slow,Atomic Habits: the life-changing million-copy #1 bestseller,Deep Work: Rules for Focused Success in a Distracted World,How to Talk to Anyone: 92 Little Tricks for Big Success in Relationships,The 5 AM Club,The Subtle Art of Not Giving a F*ck: A Counterintuitive Approach to Living a Good Life,The Alchemist,Life Changing Thoughts From Gita,Biography of Dr. Bhim Rao Ambedkar: Inspirational Biographies for Children,Biography of Swami Vivekanand: Inspirational Biographies for Children,Biography of Mahatma Gandhi: Inspirational Biographies for Children,Biography of Netaji Subhas Chandra Bose: Inspirational Biographies for Children,Exam Warriors (Revised and Updated Edition),Life in Carona: True Stories,Option Trading Handbook,Working Backwards: Insights, Stories, and Secrets from Inside Amazon,Unfinished: A Memoir,Indians: A Brief History of A Civilization"
